PMID,Title,Authors,Citation,First Author,Journal/Book,Publication Year,Create Date,PMCID,NIHMS ID,DOI
"30370648","Encephalization and longevity evolved in a correlated fashion in Euarchontoglires but not in other mammals","DeCasien AR, Thompson NA, Williams SA, Shattuck MR.","Evolution. 2018 Dec;72(12):2617-2631. doi: 10.1111/evo.13633. Epub 2018 Nov 14.","DeCasien AR","Evolution","2018","2018/10/30","","","10.1111/evo.13633"
"32060749","Spatial cognition in western gorillas (Gorilla gorilla): an analysis of distance, linearity, and speed of travel routes","Salmi R, Presotto A, Scarry CJ, Hawman P, Doran-Sheehy DM.","Anim Cogn. 2020 May;23(3):545-557. doi: 10.1007/s10071-020-01358-3. Epub 2020 Feb 14.","Salmi R","Anim Cogn","2020","2020/02/16","","","10.1007/s10071-020-01358-3"
"30447598","Sub-lethal exposure to lead is associated with heightened aggression in an urban songbird","McClelland SC, Durães Ribeiro R, Mielke HW, Finkelstein ME, Gonzales CR, Jones JA, Komdeur J, Derryberry E, Saltzberg EB, Karubian J.","Sci Total Environ. 2019 Mar 1;654:593-603. doi: 10.1016/j.scitotenv.2018.11.145. Epub 2018 Nov 11.","McClelland SC","Sci Total Environ","2019","2018/11/18","","","10.1016/j.scitotenv.2018.11.145"
"27505720","Andrographolide recovers cognitive impairment in a natural model of Alzheimer's disease (Octodon degus)","Rivera DS, Lindsay C, Codocedo JF, Morel I, Pinto C, Cisternas P, Bozinovic F, Inestrosa NC.","Neurobiol Aging. 2016 Oct;46:204-20. doi: 10.1016/j.neurobiolaging.2016.06.021. Epub 2016 Jul 5.","Rivera DS","Neurobiol Aging","2016","2016/08/10","","","10.1016/j.neurobiolaging.2016.06.021"
"28179521","Egg discrimination along a gradient of natural variation in eggshell coloration","Hanley D, Grim T, Igic B, Samaš P, López AV, Shawkey MD, Hauber ME.","Proc Biol Sci. 2017 Feb 8;284(1848):20162592. doi: 10.1098/rspb.2016.2592.","Hanley D","Proc Biol Sci","2017","2017/02/10","PMC5310612","","10.1098/rspb.2016.2592"
"29229533","Xanthoceraside attenuates amyloid β peptide(1-42)-induced memory impairments by reducing neuroinflammatory responses in mice","Qi Y, Ji XF, Chi TY, Liu P, Jin G, Xu Q, Jiao Q, Wang LH, Zou LB.","Eur J Pharmacol. 2018 Feb 5;820:18-30. doi: 10.1016/j.ejphar.2017.11.045. Epub 2017 Dec 8.","Qi Y","Eur J Pharmacol","2018","2017/12/13","","","10.1016/j.ejphar.2017.11.045"
"30936267","Variation in sexual brain size dimorphism over the breeding cycle in the three-spined stickleback","Buechel SD, Noreikiene K, DeFaveri J, Toli E, Kolm N, Merilä J.","J Exp Biol. 2019 Apr 9;222(Pt 7):jeb194464. doi: 10.1242/jeb.194464.","Buechel SD","J Exp Biol","2019","2019/04/03","","","10.1242/jeb.194464"
"29372432","When it looks and walks like an ant","Cross FR, Jackson RR.","Learn Behav. 2018 Jun;46(2):103-104. doi: 10.3758/s13420-017-0311-0.","Cross FR","Learn Behav","2018","2018/01/27","","","10.3758/s13420-017-0311-0"
"29491446","Visual stimulation-induced mild stress enhances cognitive behavior in cynomolgus monkey","Woo DH, Koh EH, Shin SH, Yang YS, Choe JC, Lee CJ, Han SC.","Sci Rep. 2018 Feb 28;8(1):3809. doi: 10.1038/s41598-018-22136-9.","Woo DH","Sci Rep","2018","2018/03/02","PMC5830581","","10.1038/s41598-018-22136-9"
"32934260","Statistical learning in domestic chicks is modulated by strain and sex","Santolin C, Rosa-Salva O, Lemaire BS, Regolin L, Vallortigara G.","Sci Rep. 2020 Sep 15;10(1):15140. doi: 10.1038/s41598-020-72090-8.","Santolin C","Sci Rep","2020","2020/09/16","PMC7492455","","10.1038/s41598-020-72090-8"
"31506055","Kin but less than kind: within-group male relatedness does not increase female fitness in seed beetles","Berg EC, Lind MI, Monahan S, Bricout S, Maklakov AA.","Proc Biol Sci. 2019 Sep 11;286(1910):20191664. doi: 10.1098/rspb.2019.1664. Epub 2019 Sep 11.","Berg EC","Proc Biol Sci","2019","2019/09/12","PMC6742989","","10.1098/rspb.2019.1664"
"29776994","First demonstration of olfactory learning and long-term memory in honey bee queens","Gong Z, Tan K, Nieh JC.","J Exp Biol. 2018 Jul 17;221(Pt 14):jeb177303. doi: 10.1242/jeb.177303.","Gong Z","J Exp Biol","2018","2018/05/20","","","10.1242/jeb.177303"
"29766979","Playing it cool: Characterizing social play, bout termination, and candidate play signals of juvenile and infant Tibetan macaques (Macaca thibetana)","Wright KR, Mayhew JA, Sheeran LK, Funkhouser JA, Wagner RS, Sun LX, Li JH.","Zool Res. 2018 Jul 18;39(4):272-283. doi: 10.24272/j.issn.2095-8137.2018.048.","Wright KR","Zool Res","2018","2018/05/17","PMC5968856","","10.24272/j.issn.2095-8137.2018.048"
"30223002","Probiotics modify body weight together with anxiety states via pro-inflammatory factors in HFD-treated Syrian golden hamster","Avolio E, Fazzari G, Zizza M, De Lorenzo A, Di Renzo L, Alò R, Facciolo RM, Canonaco M.","Behav Brain Res. 2019 Jan 1;356:390-399. doi: 10.1016/j.bbr.2018.09.010. Epub 2018 Sep 14.","Avolio E","Behav Brain Res","2019","2018/09/18","","","10.1016/j.bbr.2018.09.010"
"30848385","Guppies, Poecilia reticulata, perceive a reversed Delboeuf illusion","Lucon-Xiccato T, Santacà M, Miletto Petrazzini ME, Agrillo C, Dadda M.","Anim Cogn. 2019 May;22(3):291-303. doi: 10.1007/s10071-019-01237-6. Epub 2019 Mar 8.","Lucon-Xiccato T","Anim Cogn","2019","2019/03/09","","","10.1007/s10071-019-01237-6"
"31494800","The effects of human attentional state on canine gazing behaviour: a comparison of free-ranging, shelter, and pet dogs","Brubaker L, Bhattacharjee D, Ghaste P, Babu D, Shit P, Bhadra A, Udell MAR.","Anim Cogn. 2019 Nov;22(6):1129-1139. doi: 10.1007/s10071-019-01305-x. Epub 2019 Sep 7.","Brubaker L","Anim Cogn","2019","2019/09/09","","","10.1007/s10071-019-01305-x"
"30264371","Rapid eye movement density during REM sleep in dogs (Canis familiaris)","Kovács E, Kosztolányi A, Kis A.","Learn Behav. 2018 Dec;46(4):554-560. doi: 10.3758/s13420-018-0355-9.","Kovács E","Learn Behav","2018","2018/09/29","","","10.3758/s13420-018-0355-9"
"32154961","Primate adaptations and evolution in the Southern African Rift Valley","Bobe R, Martínez FI, Carvalho S.","Evol Anthropol. 2020 May;29(3):94-101. doi: 10.1002/evan.21826. Epub 2020 Mar 10.","Bobe R","Evol Anthropol","2020","2020/03/11","","","10.1002/evan.21826"
"30224791","Habitual tool use innovated by free-living New Zealand kea","Goodman M, Hayward T, Hunt GR.","Sci Rep. 2018 Sep 17;8(1):13935. doi: 10.1038/s41598-018-32363-9.","Goodman M","Sci Rep","2018","2018/09/19","PMC6141560","","10.1038/s41598-018-32363-9"
"30753885","Self-organizing conflicts: Group assessment and the spatio-temporal dynamics of ant territory battles","Adams ES, Plowes NJR.","Behav Processes. 2019 May;162:119-129. doi: 10.1016/j.beproc.2019.01.009. Epub 2019 Feb 10.","Adams ES","Behav Processes","2019","2019/02/13","","","10.1016/j.beproc.2019.01.009"
"31604005","Yes, correct context is indeed the key: An answer to Haave-Audet et al. 2019","Herczeg G, Urszán TJ, Orf S, Nagy G, Kotrschal A, Kolm N.","J Evol Biol. 2019 Dec;32(12):1450-1455. doi: 10.1111/jeb.13548. Epub 2019 Nov 3.","Herczeg G","J Evol Biol","2019","2019/10/12","","","10.1111/jeb.13548"
"29511943","Proactive behavior, but not inhibitory control, predicts repeated innovation by spotted hyenas tested with a multi-access box","Johnson-Ulrich L, Johnson-Ulrich Z, Holekamp K.","Anim Cogn. 2018 May;21(3):379-392. doi: 10.1007/s10071-018-1174-2. Epub 2018 Mar 6.","Johnson-Ulrich L","Anim Cogn","2018","2018/03/08","","","10.1007/s10071-018-1174-2"
"33321066","Kangaroos display gazing and gaze alternations during an unsolvable problem task","McElligott AG, O'Keeffe KH, Green AC.","Biol Lett. 2020 Dec;16(12):20200607. doi: 10.1098/rsbl.2020.0607. Epub 2020 Dec 16.","McElligott AG","Biol Lett","2020","2020/12/15","PMC7775973","","10.1098/rsbl.2020.0607"
"28736171","Northern Elephant Seals Memorize the Rhythm and Timbre of Their Rivals' Voices","Mathevon N, Casey C, Reichmuth C, Charrier I.","Curr Biol. 2017 Aug 7;27(15):2352-2356.e2. doi: 10.1016/j.cub.2017.06.035. Epub 2017 Jul 20.","Mathevon N","Curr Biol","2017","2017/07/25","","","10.1016/j.cub.2017.06.035"
"26800512","The effects of sex hormones on immune function: a meta-analysis","Foo YZ, Nakagawa S, Rhodes G, Simmons LW.","Biol Rev Camb Philos Soc. 2017 Feb;92(1):551-571. doi: 10.1111/brv.12243. Epub 2016 Jan 22.","Foo YZ","Biol Rev Camb Philos Soc","2017","2016/01/23","","","10.1111/brv.12243"
"32333423","Low relationship quality predicts scratch contagion during tense situations in orangutans (Pongo pygmaeus)","Laméris DW, van Berlo E, Sterck EHM, Bionda T, Kret ME.","Am J Primatol. 2020 Jul;82(7):e23138. doi: 10.1002/ajp.23138. Epub 2020 Apr 24.","Laméris DW","Am J Primatol","2020","2020/04/26","PMC7379188","","10.1002/ajp.23138"
"29263372","Seabird species vary in behavioural response to drone census","Brisson-Curadeau É, Bird D, Burke C, Fifield DA, Pace P, Sherley RB, Elliott KH.","Sci Rep. 2017 Dec 20;7(1):17884. doi: 10.1038/s41598-017-18202-3.","Brisson-Curadeau É","Sci Rep","2017","2017/12/22","PMC5738335","","10.1038/s41598-017-18202-3"
"29848648","Quantifying uncertainty due to fission-fusion dynamics as a component of social complexity","Ramos-Fernandez G, King AJ, Beehner JC, Bergman TJ, Crofoot MC, Di Fiore A, Lehmann J, Schaffner CM, Snyder-Mackler N, Zuberbühler K, Aureli F, Boyer D.","Proc Biol Sci. 2018 May 30;285(1879):20180532. doi: 10.1098/rspb.2018.0532.","Ramos-Fernandez G","Proc Biol Sci","2018","2018/06/01","PMC5998110","","10.1098/rspb.2018.0532"
"31839453","Ant Foragers Compensate for the Nutritional Deficiencies in the Colony","Csata E, Gautrais J, Bach A, Blanchet J, Ferrante J, Fournier F, Lévesque T, Simpson SJ, Dussutour A.","Curr Biol. 2020 Jan 6;30(1):135-142.e4. doi: 10.1016/j.cub.2019.11.019. Epub 2019 Dec 12.","Csata E","Curr Biol","2020","2019/12/17","","","10.1016/j.cub.2019.11.019"
"28693720","Individual recognition and the 'face inversion effect' in medaka fish (Oryzias latipes)","Wang MY, Takeuchi H.","Elife. 2017 Jul 11;6:e24728. doi: 10.7554/eLife.24728.","Wang MY","Elife","2017","2017/07/12","PMC5505697","","10.7554/eLife.24728"
"30467156","The decline of Africa's largest mammals","Bobe R, Carvalho S.","Science. 2018 Nov 23;362(6417):892-893. doi: 10.1126/science.aav6883.","Bobe R","Science","2018","2018/11/24","","","10.1126/science.aav6883"
"30508222","Geophagy among nonhuman primates: A systematic review of current knowledge and suggestions for future directions","Pebsworth PA, Huffman MA, Lambert JE, Young SL.","Am J Phys Anthropol. 2019 Jan;168 Suppl 67:164-194. doi: 10.1002/ajpa.23724. Epub 2018 Dec 3.","Pebsworth PA","Am J Phys Anthropol","2019","2018/12/04","","","10.1002/ajpa.23724"
"30018286","Electric pulse characteristics can enable species recognition in African weakly electric fish species","Nagel R, Kirschbaum F, Hofmann V, Engelmann J, Tiedemann R.","Sci Rep. 2018 Jul 17;8(1):10799. doi: 10.1038/s41598-018-29132-z.","Nagel R","Sci Rep","2018","2018/07/19","PMC6050243","","10.1038/s41598-018-29132-z"
"29021558","Cognition in the field: comparison of reversal learning performance in captive and wild passerines","Cauchoix M, Hermer E, Chaine AS, Morand-Ferron J.","Sci Rep. 2017 Oct 11;7(1):12945. doi: 10.1038/s41598-017-13179-5.","Cauchoix M","Sci Rep","2017","2017/10/13","PMC5636806","","10.1038/s41598-017-13179-5"
"27311774","Behavioral and functional strategies during tool use tasks in bonobos","Bardo A, Borel A, Meunier H, Guéry JP, Pouydebat E.","Am J Phys Anthropol. 2016 Sep;161(1):125-40. doi: 10.1002/ajpa.23015. Epub 2016 Jun 17.","Bardo A","Am J Phys Anthropol","2016","2016/06/18","","","10.1002/ajpa.23015"
"31710758","Chimpanzees help others with what they want; children help them with what they need","Hepach R, Benziad L, Tomasello M.","Dev Sci. 2020 May;23(3):e12922. doi: 10.1111/desc.12922. Epub 2019 Dec 6.","Hepach R","Dev Sci","2020","2019/11/12","","","10.1111/desc.12922"
"31431539","Reply to Vonk: Disentangling emotional contagion from its underlying causes","Adriaense JEC, Martin JS, Schiestl M, Lamm C, Bugnyar T.","Proc Natl Acad Sci U S A. 2019 Sep 10;116(37):18169-18170. doi: 10.1073/pnas.1910556116. Epub 2019 Aug 20.","Adriaense JEC","Proc Natl Acad Sci U S A","2019","2019/08/22","PMC6744921","","10.1073/pnas.1910556116"
"32311527","Act now before its too late: Copper exposure drives chemo-ecology of predator-prey dynamics of freshwater common spiny loach, Lepidocephalichthys thermalis (Valenciennes, 1846)","Gosavi SM, Tapkir SD, Kumkar P, Verma CR, Kharat SS.","Environ Res. 2020 Jul;186:109509. doi: 10.1016/j.envres.2020.109509. Epub 2020 Apr 14.","Gosavi SM","Environ Res","2020","2020/04/21","","","10.1016/j.envres.2020.109509"
"31515648","When are egg-rejection cues perceived? A test using thermochromic eggs in an avian brood parasite host","Hauber ME, Dainson M, Luro A, Louder AA, Hanley D.","Anim Cogn. 2019 Nov;22(6):1141-1148. doi: 10.1007/s10071-019-01306-w. Epub 2019 Sep 12.","Hauber ME","Anim Cogn","2019","2019/09/14","","","10.1007/s10071-019-01306-w"
"32841856","Sources of individual variation in problem-solving performance in urban great tits (Parus major): Exploring effects of metal pollution, urban disturbance and personality","Grunst AS, Grunst ML, Pinxten R, Eens M.","Sci Total Environ. 2020 Dec 20;749:141436. doi: 10.1016/j.scitotenv.2020.141436. Epub 2020 Aug 3.","Grunst AS","Sci Total Environ","2020","2020/08/26","","","10.1016/j.scitotenv.2020.141436"
"29391604","Free-living greylag geese adjust their heart rates and body core temperatures to season and reproductive context","Wascher CAF, Kotrschal K, Arnold W.","Sci Rep. 2018 Feb 1;8(1):2142. doi: 10.1038/s41598-018-20655-z.","Wascher CAF","Sci Rep","2018","2018/02/03","PMC5794972","","10.1038/s41598-018-20655-z"
"29386557","Spatial memory is as important as weapon and body size for territorial ownership in a lekking hummingbird","Araya-Salas M, Gonzalez-Gomez P, Wojczulanis-Jakubas K, López V 3rd, Wright TF.","Sci Rep. 2018 Jan 31;8(1):2001. doi: 10.1038/s41598-018-20441-x.","Araya-Salas M","Sci Rep","2018","2018/02/02","PMC5792557","","10.1038/s41598-018-20441-x"
"28245979","Ontogenetic shift in plant-related cognitive specialization by a mosquito-eating predator","Carvell GE, Jackson RR, Cross FR.","Behav Processes. 2017 May;138:105-122. doi: 10.1016/j.beproc.2017.02.022. Epub 2017 Feb 27.","Carvell GE","Behav Processes","2017","2017/03/02","PMC5407888","NIHMS858379","10.1016/j.beproc.2017.02.022"
"29806245","Does repeated human handling of study animals during the mating season affect their offspring?","Swierk L, Langkilde T.","J Exp Zool A Ecol Integr Physiol. 2018 Feb;329(2):80-86. doi: 10.1002/jez.2177. Epub 2018 May 27.","Swierk L","J Exp Zool A Ecol Integr Physiol","2018","2018/05/29","","","10.1002/jez.2177"
"29178336","Taking error into account when fitting models using Approximate Bayesian Computation","van der Vaart E, Prangle D, Sibly RM.","Ecol Appl. 2018 Mar;28(2):267-274. doi: 10.1002/eap.1656. Epub 2018 Jan 23.","van der Vaart E","Ecol Appl","2018","2017/11/28","","","10.1002/eap.1656"
"32647185","Enriched environments enhance cognition, exploratory behaviour and brain physiological functions of Sparus aurata","Arechavala-Lopez P, Caballero-Froilán JC, Jiménez-García M, Capó X, Tejada S, Saraiva JL, Sureda A, Moranta D.","Sci Rep. 2020 Jul 9;10(1):11252. doi: 10.1038/s41598-020-68306-6.","Arechavala-Lopez P","Sci Rep","2020","2020/07/11","PMC7347547","","10.1038/s41598-020-68306-6"
"29702178","Female hatchling American kestrels have a larger hippocampus than males: A link with sexual size dimorphism?","Guigueno MF, Karouna-Renier NK, Henry PFP, Head JA, Peters LE, Palace VP, Letcher RJ, Fernie KJ.","Behav Brain Res. 2018 Sep 3;349:98-101. doi: 10.1016/j.bbr.2018.04.037. Epub 2018 Apr 24.","Guigueno MF","Behav Brain Res","2018","2018/04/28","","","10.1016/j.bbr.2018.04.037"
"29075457","Territory surveillance and prey management: Wolves keep track of space and time","Schlägel UE, Merrill EH, Lewis MA.","Ecol Evol. 2017 Sep 9;7(20):8388-8405. doi: 10.1002/ece3.3176. eCollection 2017 Oct.","Schlägel UE","Ecol Evol","2017","2017/10/28","PMC5648667","","10.1002/ece3.3176"
"29494640","Consistent individual differences and population plasticity in network-derived sociality: An experimental manipulation of density in a gregarious ungulate","O'Brien PP, Webber QMR, Vander Wal E.","PLoS One. 2018 Mar 1;13(3):e0193425. doi: 10.1371/journal.pone.0193425. eCollection 2018.","O'Brien PP","PLoS One","2018","2018/03/02","PMC5832262","","10.1371/journal.pone.0193425"
"30349971","Separate brain areas for processing human and dog faces as revealed by awake fMRI in dogs (Canis familiaris)","Thompkins AM, Ramaiahgari B, Zhao S, Gotoor SSR, Waggoner P, Denney TS, Deshpande G, Katz JS.","Learn Behav. 2018 Dec;46(4):561-573. doi: 10.3758/s13420-018-0352-z.","Thompkins AM","Learn Behav","2018","2018/10/24","","","10.3758/s13420-018-0352-z"
"27209174","Reasoning by exclusion in the kea (Nestor notabilis)","O'Hara M, Schwing R, Federspiel I, Gajdon GK, Huber L.","Anim Cogn. 2016 Sep;19(5):965-75. doi: 10.1007/s10071-016-0998-x. Epub 2016 May 21.","O'Hara M","Anim Cogn","2016","2016/05/23","PMC4967098","","10.1007/s10071-016-0998-x"
"28017848","Testing the predictions of coping styles theory in threespined sticklebacks","Bensky MK, Paitz R, Pereira L, Bell AM.","Behav Processes. 2017 Mar;136:1-10. doi: 10.1016/j.beproc.2016.12.011. Epub 2016 Dec 23.","Bensky MK","Behav Processes","2017","2016/12/27","PMC5493480","NIHMS869355","10.1016/j.beproc.2016.12.011"
"28386423","Acquisition and functional consequences of social knowledge in macaques","Tiddi B, di Sorrentino EP, Fischer J, Schino G.","R Soc Open Sci. 2017 Feb 8;4(2):160639. doi: 10.1098/rsos.160639. eCollection 2017 Feb.","Tiddi B","R Soc Open Sci","2017","2017/04/08","PMC5367287","","10.1098/rsos.160639"
"28262722","Working dogs cooperate among one another by generalised reciprocity","Gfrerer N, Taborsky M.","Sci Rep. 2017 Mar 6;7:43867. doi: 10.1038/srep43867.","Gfrerer N","Sci Rep","2017","2017/03/07","PMC5338352","","10.1038/srep43867"
"28057516","Social motivation and conflict resolution tactics as potential building blocks of sociality in cichlid fishes","Balshine S, Wong MYL, Reddon AR.","Behav Processes. 2017 Aug;141(Pt 2):152-160. doi: 10.1016/j.beproc.2017.01.001. Epub 2017 Jan 3.","Balshine S","Behav Processes","2017","2017/01/07","","","10.1016/j.beproc.2017.01.001"
"27255454","Public perceptions of snakes and snakebite management: implications for conservation and human health in southern Nepal","Pandey DP, Subedi Pandey G, Devkota K, Goode M.","J Ethnobiol Ethnomed. 2016 Jun 2;12(1):22. doi: 10.1186/s13002-016-0092-0.","Pandey DP","J Ethnobiol Ethnomed","2016","2016/06/04","PMC4891849","","10.1186/s13002-016-0092-0"
"30919475","Time matching between grooming partners: Do methodological distinctions between short versus long-term reciprocation matter?","Dunayer ES, Tyrrell M, Balasubramaniam KN, Berman CM.","Am J Primatol. 2019 Apr;81(4):e22968. doi: 10.1002/ajp.22968. Epub 2019 Mar 28.","Dunayer ES","Am J Primatol","2019","2019/03/29","","","10.1002/ajp.22968"
"28298468","Selective attention in peacocks during assessment of rival males","Yorzinski JL, Patricelli GL, Bykau S, Platt ML.","J Exp Biol. 2017 Mar 15;220(Pt 6):1146-1153. doi: 10.1242/jeb.150946.","Yorzinski JL","J Exp Biol","2017","2017/03/17","","","10.1242/jeb.150946"
"26809838","Revisiting adult neurogenesis and the role of erythropoietin for neuronal and oligodendroglial differentiation in the hippocampus","Hassouna I, Ott C, Wüstefeld L, Offen N, Neher RA, Mitkovski M, Winkler D, Sperling S, Fries L, Goebbels S, Vreja IC, Hagemeyer N, Dittrich M, Rossetti MF, Kröhnert K, Hannke K, Boretius S, Zeug A, Höschen C, Dandekar T, Dere E, Neher E, Rizzoli SO, Nave KA, Sirén AL, Ehrenreich H.","Mol Psychiatry. 2016 Dec;21(12):1752-1767. doi: 10.1038/mp.2015.212. Epub 2016 Jan 26.","Hassouna I","Mol Psychiatry","2016","2016/01/27","PMC5193535","","10.1038/mp.2015.212"
"31549268","Chimpanzees use observed temporal directionality to learn novel causal relations","Tennie C, Völter CJ, Vonau V, Hanus D, Call J, Tomasello M.","Primates. 2019 Nov;60(6):517-524. doi: 10.1007/s10329-019-00754-9. Epub 2019 Sep 23.","Tennie C","Primates","2019","2019/09/25","PMC6858906","","10.1007/s10329-019-00754-9"
"30633748","One problem, too many solutions: How costly is honest signalling of need?","Számadó S, Czégel D, Zachar I.","PLoS One. 2019 Jan 11;14(1):e0208443. doi: 10.1371/journal.pone.0208443. eCollection 2019.","Számadó S","PLoS One","2019","2019/01/12","PMC6329501","","10.1371/journal.pone.0208443"
"30667241","Multiple parasitism reduces egg rejection in the host (Acrocephalus arundinaceus) of a mimetic avian brood parasite (Cuculus canorus)","Manna TJ, Moskát C, Tong L, Bán M, Aidala Z, Low J, Hauber ME.","J Comp Psychol. 2019 Aug;133(3):351-358. doi: 10.1037/com0000166. Epub 2019 Jan 21.","Manna TJ","J Comp Psychol","2019","2019/01/23","","","10.1037/com0000166"
"29980940","A new approach to understanding canine social cognition","Udell MAR.","Learn Behav. 2018 Dec;46(4):329-330. doi: 10.3758/s13420-018-0334-1.","Udell MAR","Learn Behav","2018","2018/07/08","","","10.3758/s13420-018-0334-1"
"31351009","Rapid acquisition of memory in a complex landscape by a mule deer","Jakopak RP, LaSharr TN, Dwinnell SPH, Fralick GL, Monteith KL.","Ecology. 2019 Dec;100(12):e02854. doi: 10.1002/ecy.2854. Epub 2019 Sep 6.","Jakopak RP","Ecology","2019","2019/07/28","","","10.1002/ecy.2854"
"29020028","Learning speed is affected by personality and reproductive investment in a songbird","Rivera-Gutierrez HF, Martens T, Pinxten R, Eens M.","PLoS One. 2017 Oct 11;12(10):e0185410. doi: 10.1371/journal.pone.0185410. eCollection 2017.","Rivera-Gutierrez HF","PLoS One","2017","2017/10/12","PMC5636094","","10.1371/journal.pone.0185410"
"30072461","The known unknowns: recognition and awareness of disease","Wall R.","Vet Rec. 2018 Aug 4;183(5):157-158. doi: 10.1136/vr.k3314.","Wall R","Vet Rec","2018","2018/08/04","","","10.1136/vr.k3314"
"28222237","Extreme genetic structure in a social bird species despite high dispersal capacity","Morinha F, Dávila JA, Bastos E, Cabral JA, Frías Ó, González JL, Travassos P, Carvalho D, Milá B, Blanco G.","Mol Ecol. 2017 May;26(10):2812-2825. doi: 10.1111/mec.14069. Epub 2017 Mar 13.","Morinha F","Mol Ecol","2017","2017/02/22","","","10.1111/mec.14069"
"30372107","Like chimpanzees (Pan troglodytes), pigeons (Columba livia domestica) match and Nash equilibrate where humans (Homo sapiens) do not","Hachiga Y, Schwartz LP, Tripoli C, Michaels S, Kearns D, Silberberg A.","J Comp Psychol. 2019 May;133(2):197-206. doi: 10.1037/com0000144. Epub 2018 Oct 29.","Hachiga Y","J Comp Psychol","2019","2018/10/30","PMC6488457","NIHMS984054","10.1037/com0000144"
"30375414","A task-experienced partner does not help dogs be as successful as wolves in a cooperative string-pulling task","Marshall-Pescini S, Basin C, Range F.","Sci Rep. 2018 Oct 30;8(1):16049. doi: 10.1038/s41598-018-33771-7.","Marshall-Pescini S","Sci Rep","2018","2018/10/31","PMC6207655","","10.1038/s41598-018-33771-7"
"30252982","The effects of living in an outdoor enclosure on hippocampal plasticity and anxiety-like behavior in response to nematode infection","Cope EC, Opendak M, LaMarca EA, Murthy S, Park CY, Olson LB, Martinez S, Leung JM, Graham AL, Gould E.","Hippocampus. 2019 Apr;29(4):366-377. doi: 10.1002/hipo.23033. Epub 2018 Nov 22.","Cope EC","Hippocampus","2019","2018/09/26","PMC6464387","NIHMS1020550","10.1002/hipo.23033"
"29622923","Avoiding the misuse of BLUP in behavioural ecology","Houslay TM, Wilson AJ.","Behav Ecol. 2017 Jul-Aug;28(4):948-952. doi: 10.1093/beheco/arx023. Epub 2017 Mar 2.","Houslay TM","Behav Ecol","2017","2018/04/07","PMC5873244","","10.1093/beheco/arx023"
"33189403","On Multifaceted Definitions of Multilevel Societies: Response to Papageorgiou and Farine","Grueter CC, Qi X, Zinner D, Bergman T, Li M, Xiang Z, Zhu P, Miller A, Krützen M, Fischer J, Rubenstein DI, Vidya TNC, Li B, Cantor M, Swedell L.","Trends Ecol Evol. 2021 Jan;36(1):17-19. doi: 10.1016/j.tree.2020.10.012. Epub 2020 Nov 11.","Grueter CC","Trends Ecol Evol","2021","2020/11/15","","","10.1016/j.tree.2020.10.012"
"28818500","Cryptic sexual dimorphism in spatial memory and hippocampal oxytocin receptors in prairie voles (Microtus ochrogaster)","Rice MA, Hobbs LE, Wallace KJ, Ophir AG.","Horm Behav. 2017 Sep;95:94-102. doi: 10.1016/j.yhbeh.2017.08.003. Epub 2017 Aug 30.","Rice MA","Horm Behav","2017","2017/08/19","PMC5623076","NIHMS903178","10.1016/j.yhbeh.2017.08.003"
"30104435","Stress hormones, social associations and song learning in zebra finches","Boogert NJ, Lachlan RF, Spencer KA, Templeton CN, Farine DR.","Philos Trans R Soc Lond B Biol Sci. 2018 Sep 26;373(1756):20170290. doi: 10.1098/rstb.2017.0290.","Boogert NJ","Philos Trans R Soc Lond B Biol Sci","2018","2018/08/15","PMC6107560","","10.1098/rstb.2017.0290"
"30914721","Glucocorticoids do not influence a secondary sexual trait or its behavioral expression in eastern fence lizards","MacLeod KJ, McCormick GL, Langkilde T.","Sci Rep. 2019 Mar 26;9(1):5229. doi: 10.1038/s41598-019-41596-1.","MacLeod KJ","Sci Rep","2019","2019/03/28","PMC6435798","","10.1038/s41598-019-41596-1"
"30305440","Wild chimpanzees select tool material based on efficiency and knowledge","Lamon N, Neumann C, Gier J, Zuberbühler K, Gruber T.","Proc Biol Sci. 2018 Oct 10;285(1888):20181715. doi: 10.1098/rspb.2018.1715.","Lamon N","Proc Biol Sci","2018","2018/10/12","PMC6191692","","10.1098/rspb.2018.1715"
