PMID,Title,Authors,Citation,First Author,Journal/Book,Publication Year,Create Date,PMCID,NIHMS ID,DOI
"27576530","Developmental lead exposure has mixed effects on butterfly cognitive processes","Philips KH, Kobiela ME, Snell-Rood EC.","Anim Cogn. 2017 Jan;20(1):87-96. doi: 10.1007/s10071-016-1029-7. Epub 2016 Aug 30.","Philips KH","Anim Cogn","2017","2016/09/01","","","10.1007/s10071-016-1029-7"
"28483429","Melanism is related to behavioural lateralization in nestling barn owls","Gaillard M, Scriba MF, Roulin A.","Behav Processes. 2017 Jul;140:139-143. doi: 10.1016/j.beproc.2017.05.006. Epub 2017 May 5.","Gaillard M","Behav Processes","2017","2017/05/10","","","10.1016/j.beproc.2017.05.006"
"30333265","Learning from others: an invasive lizard uses social information from both conspecifics and heterospecifics","Damas-Moreira I, Oliveira D, Santos JL, Riley JL, Harris DJ, Whiting MJ.","Biol Lett. 2018 Oct 17;14(10):20180532. doi: 10.1098/rsbl.2018.0532.","Damas-Moreira I","Biol Lett","2018","2018/10/19","PMC6227858","","10.1098/rsbl.2018.0532"
"29487151","Detection and direction discrimination of single vortex rings by harbour seals (Phoca vitulina)","Krüger Y, Hanke W, Miersch L, Dehnhardt G.","J Exp Biol. 2018 Apr 25;221(Pt 8):jeb170753. doi: 10.1242/jeb.170753.","Krüger Y","J Exp Biol","2018","2018/03/01","","","10.1242/jeb.170753"
"29018218","Associative visual learning by tethered bees in a controlled visual environment","Buatois A, Pichot C, Schultheiss P, Sandoz JC, Lazzari CR, Chittka L, Avarguès-Weber A, Giurfa M.","Sci Rep. 2017 Oct 10;7(1):12903. doi: 10.1038/s41598-017-12631-w.","Buatois A","Sci Rep","2017","2017/10/12","PMC5635106","","10.1038/s41598-017-12631-w"
"28902470","Female fecundity and offspring survival are not increased through sexual cannibalism in the spider Larinioides sclopetarius","Deventer SA, Herberstein ME, Mayntz D, O'Hanlon JC, Schneider JM.","J Evol Biol. 2017 Dec;30(12):2146-2155. doi: 10.1111/jeb.13178. Epub 2017 Oct 20.","Deventer SA","J Evol Biol","2017","2017/09/14","","","10.1111/jeb.13178"
"27178464","Assessing sources of error in comparative analyses of primate behavior: Intraspecific variation in group size and the social brain hypothesis","Sandel AA, Miller JA, Mitani JC, Nunn CL, Patterson SK, Garamszegi LZ.","J Hum Evol. 2016 May;94:126-33. doi: 10.1016/j.jhevol.2016.03.007. Epub 2016 Apr 29.","Sandel AA","J Hum Evol","2016","2016/05/15","PMC5436711","NIHMS859681","10.1016/j.jhevol.2016.03.007"
"26781057","The execution of planned detours by spider-eating predators","Cross FR, Jackson RR.","J Exp Anal Behav. 2016 Jan;105(1):194-210. doi: 10.1002/jeab.189.","Cross FR","J Exp Anal Behav","2016","2016/01/20","PMC4751061","NIHMS744968","10.1002/jeab.189"
"27243451","The vocal repertoire of Tibetan macaques (Macaca thibetana): A quantitative classification","Bernstein SK, Sheeran LK, Wagner RS, Li JH, Koda H.","Am J Primatol. 2016 Sep;78(9):937-49. doi: 10.1002/ajp.22564. Epub 2016 May 31.","Bernstein SK","Am J Primatol","2016","2016/06/01","","","10.1002/ajp.22564"
"27864050","Ancestry trumps experience: Transgenerational but not early life stress affects the adult physiological stress response","McCormick GL, Robbins TR, Cavigelli SA, Langkilde T.","Horm Behav. 2017 Jan;87:115-121. doi: 10.1016/j.yhbeh.2016.11.010. Epub 2016 Nov 15.","McCormick GL","Horm Behav","2017","2016/11/20","","","10.1016/j.yhbeh.2016.11.010"
"29930280","Wild Norway Rats Do Not Avoid Predator Scents When Collecting Food in a Familiar Habitat: A Field Study","Stryjek R, Mioduszewska B, Spaltabaka-Gędek E, Juszczak GR.","Sci Rep. 2018 Jun 21;8(1):9475. doi: 10.1038/s41598-018-27054-4.","Stryjek R","Sci Rep","2018","2018/06/23","PMC6013492","","10.1038/s41598-018-27054-4"
"27437926","A novel tool-use mode in animals: New Caledonian crows insert tools to transport objects","Jacobs IF, von Bayern A, Osvath M.","Anim Cogn. 2016 Nov;19(6):1249-1252. doi: 10.1007/s10071-016-1016-z. Epub 2016 Jul 20.","Jacobs IF","Anim Cogn","2016","2016/07/21","PMC5054045","","10.1007/s10071-016-1016-z"
"26834589","Parallel Olfactory Processing in the Honey Bee Brain: Odor Learning and Generalization under Selective Lesion of a Projection Neuron Tract","Carcaud J, Giurfa M, Sandoz JC.","Front Integr Neurosci. 2016 Jan 19;9:75. doi: 10.3389/fnint.2015.00075. eCollection 2015.","Carcaud J","Front Integr Neurosci","2016","2016/02/03","PMC4717326","","10.3389/fnint.2015.00075"
"27475207","Classification and automatic transcription of primate calls","Versteegh M, Kuhn J, Synnaeve G, Ravaux L, Chemla E, Cäsar C, Fuller J, Murphy D, Schel A, Dunbar E.","J Acoust Soc Am. 2016 Jul;140(1):EL26. doi: 10.1121/1.4954887.","Versteegh M","J Acoust Soc Am","2016","2016/08/01","","","10.1121/1.4954887"
"28856458","Floral guidance of learning a preference for symmetry by bumblebees","Plowright CMS, Bridger JJM, Xu V, Herlehy RA, Collin CA.","Anim Cogn. 2017 Nov;20(6):1115-1127. doi: 10.1007/s10071-017-1128-0. Epub 2017 Aug 30.","Plowright CMS","Anim Cogn","2017","2017/09/01","","","10.1007/s10071-017-1128-0"
"27579491","Does the Structure of Female Rhesus Macaque Coo Calls Reflect Relatedness and/or Familiarity?","Pfefferle D, Hammerschmidt K, Mundry R, Ruiz-Lambides AV, Fischer J, Widdig A.","PLoS One. 2016 Aug 31;11(8):e0161133. doi: 10.1371/journal.pone.0161133. eCollection 2016.","Pfefferle D","PLoS One","2016","2016/09/01","PMC5007041","","10.1371/journal.pone.0161133"
"29070719","Higher iridescent-to-pigment optical effect in flowers facilitates learning, memory and generalization in foraging bumblebees","de Premorel G, Giurfa M, Andraud C, Gomez D.","Proc Biol Sci. 2017 Oct 25;284(1865):20171097. doi: 10.1098/rspb.2017.1097.","de Premorel G","Proc Biol Sci","2017","2017/10/27","PMC5666091","","10.1098/rspb.2017.1097"
"27357664","Insects cannot tell us anything about subjective experience or the origin of consciousness","Key B, Arlinghaus R, Browman HI.","Proc Natl Acad Sci U S A. 2016 Jul 5;113(27):E3813. doi: 10.1073/pnas.1606835113. Epub 2016 Jun 28.","Key B","Proc Natl Acad Sci U S A","2016","2016/07/01","PMC4941505","","10.1073/pnas.1606835113"
"26763219","Sexual harassment induces a temporary fitness cost but does not constrain the acquisition of environmental information in fruit flies","Teseo S, Veerus L, Moreno C, Mery F.","Biol Lett. 2016 Jan;12(1):20150917. doi: 10.1098/rsbl.2015.0917.","Teseo S","Biol Lett","2016","2016/01/15","PMC4785929","","10.1098/rsbl.2015.0917"
"27299293","There's no ball without noise: cats' prediction of an object from noise","Takagi S, Arahori M, Chijiiwa H, Tsuzuki M, Hataji Y, Fujita K.","Anim Cogn. 2016 Sep;19(5):1043-7. doi: 10.1007/s10071-016-1001-6. Epub 2016 Jun 14.","Takagi S","Anim Cogn","2016","2016/06/15","","","10.1007/s10071-016-1001-6"
"28864563","Induced parental care in a poison frog: a tadpole cross-fostering experiment","Pašukonis A, Beck KB, Fischer MT, Weinlein S, Stückler S, Ringler E.","J Exp Biol. 2017 Nov 1;220(Pt 21):3949-3954. doi: 10.1242/jeb.165126. Epub 2017 Sep 1.","Pašukonis A","J Exp Biol","2017","2017/09/03","PMC5702076","","10.1242/jeb.165126"
"28167803","Saccadic movement strategy in a semiaquatic species - the harbour seal (Phoca vitulina)","Geurten BRH, Niesterok B, Dehnhardt G, Hanke FD.","J Exp Biol. 2017 Apr 15;220(Pt 8):1503-1508. doi: 10.1242/jeb.150763. Epub 2017 Feb 6.","Geurten BRH","J Exp Biol","2017","2017/02/08","","","10.1242/jeb.150763"
"28811370","Decoding ants' olfactory system sheds light on the evolution of social communication","d'Ettorre P, Deisig N, Sandoz JC.","Proc Natl Acad Sci U S A. 2017 Aug 22;114(34):8911-8913. doi: 10.1073/pnas.1711075114. Epub 2017 Aug 15.","d'Ettorre P","Proc Natl Acad Sci U S A","2017","2017/08/17","PMC5576840","","10.1073/pnas.1711075114"
"29045402","Triadic male-infant-male interaction serves in bond maintenance in male Assamese macaques","Kalbitz J, Schülke O, Ostner J.","PLoS One. 2017 Oct 18;12(10):e0183981. doi: 10.1371/journal.pone.0183981. eCollection 2017.","Kalbitz J","PLoS One","2017","2017/10/19","PMC5646793","","10.1371/journal.pone.0183981"
"30475392","Monkey business: Collaborating to grow an ecological physiology of primates","Thompson CL, Vinyard CJ.","Am J Primatol. 2019 May;81(5):e22934. doi: 10.1002/ajp.22934. Epub 2018 Nov 26.","Thompson CL","Am J Primatol","2019","2018/11/27","","","10.1002/ajp.22934"
"27984082","Effect of an anti-malaria drug on behavioural performance on a problem-solving task: an experiment in wild great tits","Cauchard L, Angers B, Boogert NJ, Doligez B.","Behav Processes. 2016 Oct 29:S0376-6357(16)30321-7. doi: 10.1016/j.beproc.2016.10.012. Online ahead of print.","Cauchard L","Behav Processes","2016","2016/12/17","","","10.1016/j.beproc.2016.10.012"
"26729937","How institutions shaped the last major evolutionary transition to large-scale human societies","Powers ST, van Schaik CP, Lehmann L.","Philos Trans R Soc Lond B Biol Sci. 2016 Feb 5;371(1687):20150098. doi: 10.1098/rstb.2015.0098.","Powers ST","Philos Trans R Soc Lond B Biol Sci","2016","2016/01/06","PMC4760198","","10.1098/rstb.2015.0098"
"28679792","Hydrodynamic sensory threshold in harbour seals (Phoca vitulina) for artificial flatfish breathing currents","Niesterok B, Dehnhardt G, Hanke W.","J Exp Biol. 2017 Jul 1;220(Pt 13):2364-2371. doi: 10.1242/jeb.158055.","Niesterok B","J Exp Biol","2017","2017/07/07","","","10.1242/jeb.158055"
"26831111","An ecocultural model predicts Neanderthal extinction through competition with modern humans","Gilpin W, Feldman MW, Aoki K.","Proc Natl Acad Sci U S A. 2016 Feb 23;113(8):2134-9. doi: 10.1073/pnas.1524861113. Epub 2016 Feb 1.","Gilpin W","Proc Natl Acad Sci U S A","2016","2016/02/03","PMC4776499","","10.1073/pnas.1524861113"
"28059791","Mitochondrial Repair Effects of Oxygen Treatment on Alzheimer's Disease Model Mice Revealed by Quantitative Proteomics","Wang H, Hong X, Wang Y.","J Alzheimers Dis. 2017;56(3):875-883. doi: 10.3233/JAD-161010.","Wang H","J Alzheimers Dis","2017","2017/01/07","","","10.3233/JAD-161010"
"28003519","A trade-off between reproductive investment and maternal cerebellum size in a precocial bird","Ebneter C, Pick JL, Tschirren B.","Biol Lett. 2016 Dec;12(12):20160659. doi: 10.1098/rsbl.2016.0659.","Ebneter C","Biol Lett","2016","2016/12/23","PMC5206586","","10.1098/rsbl.2016.0659"
"26822452","Quantifying soluble carbohydrates in tropical leaves using a portable mid-infrared sensor: Implications for primate feeding ecology","Dunham NT, Kane EE, Rodriguez-Saona LE.","Am J Primatol. 2016 Jul;78(7):701-6. doi: 10.1002/ajp.22533. Epub 2016 Jan 28.","Dunham NT","Am J Primatol","2016","2016/01/30","","","10.1002/ajp.22533"
"27385831","Rationalizing spatial exploration patterns of wild animals and humans through a temporal discounting framework","Namboodiri VM, Levy JM, Mihalas S, Sims DW, Hussain Shuler MG.","Proc Natl Acad Sci U S A. 2016 Aug 2;113(31):8747-52. doi: 10.1073/pnas.1601664113. Epub 2016 Jul 6.","Namboodiri VM","Proc Natl Acad Sci U S A","2016","2016/07/08","PMC4978240","","10.1073/pnas.1601664113"
"30221347","Increased developmental density decreases the magnitude of indirect genetic effects expressed during agonistic interactions in an insect","Han CS, Tuni C, Ulcik J, Dingemanse NJ.","Evolution. 2018 Nov;72(11):2435-2448. doi: 10.1111/evo.13600. Epub 2018 Sep 24.","Han CS","Evolution","2018","2018/09/18","","","10.1111/evo.13600"
"27444515","Macrodinychus mites as parasitoids of invasive ants: an overlooked parasitic association","Lachaud JP, Klompen H, Pérez-Lachaud G.","Sci Rep. 2016 Jul 21;6:29995. doi: 10.1038/srep29995.","Lachaud JP","Sci Rep","2016","2016/07/23","PMC4956750","","10.1038/srep29995"
"27431611","Travel fosters tool use in wild chimpanzees","Gruber T, Zuberbühler K, Neumann C.","Elife. 2016 Jul 19;5:e16371. doi: 10.7554/eLife.16371.","Gruber T","Elife","2016","2016/07/20","PMC4972540","","10.7554/eLife.16371"
"26787139","Selection on learning performance results in the correlated evolution of sexual dimorphism in life history","Zwoinska MK, Lind MI, Cortazar-Chinarro M, Ramsden M, Maklakov AA.","Evolution. 2016 Feb;70(2):342-57. doi: 10.1111/evo.12862. Epub 2016 Feb 3.","Zwoinska MK","Evolution","2016","2016/01/21","","","10.1111/evo.12862"
"27734208","Triadic awareness predicts partner choice in male-infant-male interactions in Barbary macaques","Kubenova B, Konecna M, Majolo B, Smilauer P, Ostner J, Schülke O.","Anim Cogn. 2017 Mar;20(2):221-232. doi: 10.1007/s10071-016-1041-y. Epub 2016 Oct 12.","Kubenova B","Anim Cogn","2017","2016/10/14","","","10.1007/s10071-016-1041-y"
"26994170","Determination of the wingsnap sonation mechanism of the golden-collared manakin (Manacus vitellinus)","Bodony DJ, Day L, Friscia AR, Fusani L, Karon A, Swenson GW Jr, Wikelski M, Schlinger BA.","J Exp Biol. 2016 May 15;219(Pt 10):1524-34. doi: 10.1242/jeb.128231. Epub 2016 Mar 18.","Bodony DJ","J Exp Biol","2016","2016/03/20","","","10.1242/jeb.128231"
"26643122","A Comparative Morphometric Analysis of Three Cranial Nerves in Two Phocids: The Hooded Seal (Cystophora cristata) and the Harbor Seal (Phoca vitulina)","Wohlert D, Kröger J, Witt M, Schmitt O, Wree A, Czech-Damal N, Siebert U, Folkow L, Hanke FD.","Anat Rec (Hoboken). 2016 Mar;299(3):370-8. doi: 10.1002/ar.23298. Epub 2015 Dec 21.","Wohlert D","Anat Rec (Hoboken)","2016","2015/12/09","","","10.1002/ar.23298"
"27000944","Irresistible ants: exposure to novel toxic prey increases consumption over multiple temporal scales","Herr MW, Robbins TR, Centi A, Thawley CJ, Langkilde T.","Oecologia. 2016 Jul;181(3):749-56. doi: 10.1007/s00442-016-3596-3. Epub 2016 Mar 21.","Herr MW","Oecologia","2016","2016/03/23","","","10.1007/s00442-016-3596-3"
"28040008","Underwater sound localization of pure tones in the median plane by harbor seals (Phoca vitulina)","Byl JA, Miersch L, Wieskotten S, Dehnhardt G.","J Acoust Soc Am. 2016 Dec;140(6):4490. doi: 10.1121/1.4972531.","Byl JA","J Acoust Soc Am","2016","2017/01/02","","","10.1121/1.4972531"
"32110702","Estimation of baboon daily travel distances by means of point sampling - the magnitude of underestimation","Sennhenn-Reulen H, Diedhiou L, Klapproth M, Zinner D.","Primate Biol. 2017 Jul 10;4(2):143-151. doi: 10.5194/pb-4-143-2017. eCollection 2017.","Sennhenn-Reulen H","Primate Biol","2017","2020/02/29","PMC7041532","","10.5194/pb-4-143-2017"
"31182745","Context dependent life-history shift in Macrodinychus sellnicki mites attacking a native ant host in Colombia","Pérez-Lachaud G, Klompen H, Poteaux C, Santamaría C, Armbrecht I, Beugnon G, Lachaud JP.","Sci Rep. 2019 Jun 10;9(1):8394. doi: 10.1038/s41598-019-44791-2.","Pérez-Lachaud G","Sci Rep","2019","2019/06/12","PMC6557818","","10.1038/s41598-019-44791-2"
"33186409","Heat and dehydration induced oxidative damage and antioxidant defenses following incubator heat stress and a simulated heat wave in wild caught four-striped field mice Rhabdomys dilectus","Jacobs PJ, Oosthuizen MK, Mitchell C, Blount JD, Bennett NC.","PLoS One. 2020 Nov 13;15(11):e0242279. doi: 10.1371/journal.pone.0242279. eCollection 2020.","Jacobs PJ","PLoS One","2020","2020/11/13","PMC7665817","","10.1371/journal.pone.0242279"
"32307710","Territory acquisition mediates the influence of predators and climate on juvenile red squirrel survival","Hendrix JG, Fisher DN, Martinig AR, Boutin S, Dantzer B, Lane JE, McAdam AG.","J Anim Ecol. 2020 Jun;89(6):1408-1418. doi: 10.1111/1365-2656.13209. Epub 2020 Apr 19.","Hendrix JG","J Anim Ecol","2020","2020/04/21","","","10.1111/1365-2656.13209"
"31329250","Recent Research on the Health Benefits of Blueberries and Their Anthocyanins","Kalt W, Cassidy A, Howard LR, Krikorian R, Stull AJ, Tremblay F, Zamora-Ros R.","Adv Nutr. 2020 Mar 1;11(2):224-236. doi: 10.1093/advances/nmz065.","Kalt W","Adv Nutr","2020","2019/07/23","PMC7442370","","10.1093/advances/nmz065"
"32704793","Understanding natural behavior to improve dairy goat (Capra hircus) management systems","Zobel G, Neave HW, Webster J.","Transl Anim Sci. 2018 Dec 31;3(1):212-224. doi: 10.1093/tas/txy145. eCollection 2019 Jan.","Zobel G","Transl Anim Sci","2018","2020/07/25","PMC7200440","","10.1093/tas/txy145"
"33329278","Gaze Following in Ungulates: Domesticated and Non-domesticated Species Follow the Gaze of Both Humans and Conspecifics in an Experimental Context","Schaffer A, Caicoya AL, Colell M, Holland R, Ensenyat C, Amici F.","Front Psychol. 2020 Nov 19;11:604904. doi: 10.3389/fpsyg.2020.604904. eCollection 2020.","Schaffer A","Front Psychol","2020","2020/12/17","PMC7711155","","10.3389/fpsyg.2020.604904"
"32621272","Seeing red? Colour biases of foraging birds are context dependent","Teichmann M, Thorogood R, Hämäläinen L.","Anim Cogn. 2020 Sep;23(5):1007-1018. doi: 10.1007/s10071-020-01407-x. Epub 2020 Jul 3.","Teichmann M","Anim Cogn","2020","2020/07/05","PMC7415751","","10.1007/s10071-020-01407-x"
"30583846","Hominin diversity and high environmental variability in the Okote Member, Koobi Fora Formation, Kenya","Bobe R, Carvalho S.","J Hum Evol. 2019 Jan;126:91-105. doi: 10.1016/j.jhevol.2018.10.012. Epub 2018 Dec 13.","Bobe R","J Hum Evol","2019","2018/12/26","","","10.1016/j.jhevol.2018.10.012"
"31218030","Using 3D modelling and printing to study avian cognition from different geometric dimensions","Yang C, Liang W, Møller AP.","R Soc Open Sci. 2019 May 15;6(5):181938. doi: 10.1098/rsos.181938. eCollection 2019 May.","Yang C","R Soc Open Sci","2019","2019/06/21","PMC6549957","","10.1098/rsos.181938"
"33139919","A meta-analysis of biological impacts of artificial light at night","Sanders D, Frago E, Kehoe R, Patterson C, Gaston KJ.","Nat Ecol Evol. 2021 Jan;5(1):74-81. doi: 10.1038/s41559-020-01322-x. Epub 2020 Nov 2.","Sanders D","Nat Ecol Evol","2021","2020/11/03","","","10.1038/s41559-020-01322-x"
"28223940","Reconsideration of Serial Visual Reversal Learning in Octopus (Octopus vulgaris) from a Methodological Perspective","Bublitz A, Weinhold SR, Strobel S, Dehnhardt G, Hanke FD.","Front Physiol. 2017 Feb 7;8:54. doi: 10.3389/fphys.2017.00054. eCollection 2017.","Bublitz A","Front Physiol","2017","2017/02/23","PMC5294351","","10.3389/fphys.2017.00054"
"27378843","What Pinnipeds Have to Say about Human Speech, Music, and the Evolution of Rhythm","Ravignani A, Fitch WT, Hanke FD, Heinrich T, Hurgitsch B, Kotz SA, Scharff C, Stoeger AS, de Boer B.","Front Neurosci. 2016 Jun 20;10:274. doi: 10.3389/fnins.2016.00274. eCollection 2016.","Ravignani A","Front Neurosci","2016","2016/07/06","PMC4913109","","10.3389/fnins.2016.00274"
"31684855","Correction to: Mitochondrial phylogeography of baboons (Papio spp.) - Indication for introgressive hybridization?","Zinner D, Groeneveld LF, Keller C, Roos C.","BMC Evol Biol. 2019 Nov 4;19(1):198. doi: 10.1186/s12862-019-1537-6.","Zinner D","BMC Evol Biol","2019","2019/11/06","PMC6827251","","10.1186/s12862-019-1537-6"
"27145030","Ionotropic Chemosensory Receptors Mediate the Taste and Smell of Polyamines","Hussain A, Zhang M, Üçpunar HK, Svensson T, Quillery E, Gompel N, Ignell R, Grunwald Kadow IC.","PLoS Biol. 2016 May 4;14(5):e1002454. doi: 10.1371/journal.pbio.1002454. eCollection 2016 May.","Hussain A","PLoS Biol","2016","2016/05/05","PMC4856413","","10.1371/journal.pbio.1002454"
"30204874","What Is Stress? A Systems Perspective","Del Giudice M, Buck CL, Chaby LE, Gormally BM, Taff CC, Thawley CJ, Vitousek MN, Wada H.","Integr Comp Biol. 2018 Dec 1;58(6):1019-1032. doi: 10.1093/icb/icy114.","Del Giudice M","Integr Comp Biol","2018","2018/09/12","","","10.1093/icb/icy114"
"29121652","Risk of predation makes foragers less choosy about their food","Charalabidis A, Dechaume-Moncharmont FX, Petit S, Bohan DA.","PLoS One. 2017 Nov 9;12(11):e0187167. doi: 10.1371/journal.pone.0187167. eCollection 2017.","Charalabidis A","PLoS One","2017","2017/11/10","PMC5679636","","10.1371/journal.pone.0187167"
"32940645","How Ambient Environment Influences Olfactory Orientation in Search and Rescue Dogs","Jinn J, Connor EG, Jacobs LF.","Chem Senses. 2020 Nov 7;45(8):625-634. doi: 10.1093/chemse/bjaa060.","Jinn J","Chem Senses","2020","2020/09/17","","","10.1093/chemse/bjaa060"
"29273038","Anti-stress and neuronal cell differentiation induction effects of Rosmarinus officinalis L. essential oil","Villareal MO, Ikeya A, Sasaki K, Arfa AB, Neffati M, Isoda H.","BMC Complement Altern Med. 2017 Dec 22;17(1):549. doi: 10.1186/s12906-017-2060-1.","Villareal MO","BMC Complement Altern Med","2017","2017/12/24","PMC5741888","","10.1186/s12906-017-2060-1"
"29787227","Nontraditional Species","O’Rourke DP, Cox JD, Baumann DP.","In: Weichbrod RH, Thompson GA, Norton JN, editors. Management of Animal Care and Use Programs in Research, Education, and Testing. 2nd edition. Boca Raton (FL): CRC Press/Taylor & Francis; 2018. Chapter 25.","O’Rourke DP","Management of Animal Care and Use Programs in Research, Education, and Testing","2018","2018/01/01","","","10.1201/9781315152189-25"
"30298687","Normal diffusivity of the domestic feline brain","Barry EF, Cerda-Gonzalez S, Luh WM, Daws RE, Raj A, Johnson PJ.","J Comp Neurol. 2019 Apr 1;527(5):1012-1023. doi: 10.1002/cne.24553. Epub 2018 Dec 21.","Barry EF","J Comp Neurol","2019","2018/10/10","","","10.1002/cne.24553"
"29895581","The origins and evolution of sleep","Keene AC, Duboue ER.","J Exp Biol. 2018 Jun 12;221(Pt 11):jeb159533. doi: 10.1242/jeb.159533.","Keene AC","J Exp Biol","2018","2018/06/14","PMC6515771","","10.1242/jeb.159533"
"29166127","Bat Biology, Genomes, and the Bat1K Project: To Generate Chromosome-Level Genomes for All Living Bat Species","Teeling EC, Vernes SC, Dávalos LM, Ray DA, Gilbert MTP, Myers E; Bat1K Consortium.","Annu Rev Anim Biosci. 2018 Feb 15;6:23-46. doi: 10.1146/annurev-animal-022516-022811. Epub 2017 Nov 20.","Teeling EC","Annu Rev Anim Biosci","2018","2017/11/23","","","10.1146/annurev-animal-022516-022811"
"29180423","Prenatal stress accelerates offspring growth to compensate for reduced maternal investment across mammals","Berghänel A, Heistermann M, Schülke O, Ostner J.","Proc Natl Acad Sci U S A. 2017 Dec 12;114(50):E10658-E10666. doi: 10.1073/pnas.1707152114. Epub 2017 Nov 27.","Berghänel A","Proc Natl Acad Sci U S A","2017","2017/11/29","PMC5740685","","10.1073/pnas.1707152114"
"31063801","A versatile macro-based neurohistological image analysis suite for ImageJ focused on automated and standardized user interaction and reproducible data output","Timothy M, Forlano PM.","J Neurosci Methods. 2019 Aug 1;324:108286. doi: 10.1016/j.jneumeth.2019.04.009. Epub 2019 May 4.","Timothy M","J Neurosci Methods","2019","2019/05/08","","","10.1016/j.jneumeth.2019.04.009"
"32015393","Machine learning decodes chemical features to identify novel agonists of a moth odorant receptor","Caballero-Vidal G, Bouysset C, Grunig H, Fiorucci S, Montagné N, Golebiowski J, Jacquin-Joly E.","Sci Rep. 2020 Feb 3;10(1):1655. doi: 10.1038/s41598-020-58564-9.","Caballero-Vidal G","Sci Rep","2020","2020/02/05","PMC6997167","","10.1038/s41598-020-58564-9"
"32796850","Reply to: ""The data do not support the existence of an 'Old Boy network' in science. Some critical comments on a study by Massen et al.""","Massen JJM, Bauer L, Spurny B, Bugnyar T, Kret ME.","Sci Rep. 2020 Aug 14;10(1):13783. doi: 10.1038/s41598-020-69108-6.","Massen JJM","Sci Rep","2020","2020/08/16","PMC7427780","","10.1038/s41598-020-69108-6"
"32522409","Archerfish vision: Visual challenges faced by a predator with a unique hunting technique","Newport C, Schuster S.","Semin Cell Dev Biol. 2020 Oct;106:53-60. doi: 10.1016/j.semcdb.2020.05.017. Epub 2020 Jun 7.","Newport C","Semin Cell Dev Biol","2020","2020/06/12","","","10.1016/j.semcdb.2020.05.017"
"29768649","Selection for associative learning of color stimuli reveals correlated evolution of this learning ability across multiple stimuli and rewards","Liefting M, Hoedjes KM, Le Lann C, Smid HM, Ellers J.","Evolution. 2018 May 16;72(7):1449-59. doi: 10.1111/evo.13498. Online ahead of print.","Liefting M","Evolution","2018","2018/05/17","PMC6099215","","10.1111/evo.13498"
"30659082","Population history with invasive predators predicts innate immune function response to early-life glucocorticoid exposure in lizards","McCormick GL, Robbins TR, Cavigelli SA, Langkilde T.","J Exp Biol. 2019 Feb 15;222(Pt 4):jeb188359. doi: 10.1242/jeb.188359.","McCormick GL","J Exp Biol","2019","2019/01/20","","","10.1242/jeb.188359"
"29597197","Brain Activation Patterns in Response to Conspecific and Heterospecific Social Acoustic Signals in Female Plainfin Midshipman Fish, Porichthys notatus","Mohr RA, Chang Y, Bhandiwad AA, Forlano PM, Sisneros JA.","Brain Behav Evol. 2018;91(1):31-44. doi: 10.1159/000487122. Epub 2018 Mar 29.","Mohr RA","Brain Behav Evol","2018","2018/03/30","PMC5906144","NIHMS941264","10.1159/000487122"
"30296994","Personality links with lifespan in chimpanzees","Altschul DM, Hopkins WD, Herrelko ES, Inoue-Murayama M, Matsuzawa T, King JE, Ross SR, Weiss A.","Elife. 2018 Oct 9;7:e33781. doi: 10.7554/eLife.33781.","Altschul DM","Elife","2018","2018/10/10","PMC6177254","","10.7554/eLife.33781"
"29140552","The influence of phylogeny, social style, and sociodemographic factors on macaque social network structure","Balasubramaniam KN, Beisner BA, Berman CM, De Marco A, Duboscq J, Koirala S, Majolo B, MacIntosh AJ, McFarland R, Molesti S, Ogawa H, Petit O, Schino G, Sosa S, Sueur C, Thierry B, de Waal FBM, McCowan B.","Am J Primatol. 2018 Jan;80(1). doi: 10.1002/ajp.22727. Epub 2017 Nov 15.","Balasubramaniam KN","Am J Primatol","2018","2017/11/16","","","10.1002/ajp.22727"
